{
  "contractVersion": "1.0.0",
  "snapshotId": "19000000-0000-4000-8000-000000000002",
  "runId": "33333333-3333-4333-8333-333333333333",
  "sourceId": "11111111-1111-4111-8111-111111111111",
  "sourceVersionCandidate": "registration-generation-v1",
  "boundaryId": "19000000-0000-4000-8000-000000000001",
  "connectorId": "connectors/tabular-reader-v1",
  "connectorVersion": "1.0.0",
  "connectorCapabilityHash": "ccca6841c2a5d15058240039228b22351d60e6279bdcef5f1b78f687b7114ade",
  "authorizationScopeId": "authorized-assets",
  "capturedAt": "2026-01-01T00:00:20Z",
  "assets": [
    {
      "assetId": "work-records",
      "nativeName": "WorkRecords",
      "kind": "table",
      "fields": [
        { "path": "ScopeId", "physicalType": "string", "typeVariants": [], "nullable": false },
        { "path": "RecordId", "physicalType": "string", "typeVariants": [], "nullable": false },
        { "path": "VersionNumber", "physicalType": "integer", "typeVariants": [], "nullable": false }
      ],
      "constraints": ["scoped-record-identity"]
    },
    {
      "assetId": "work-events",
      "nativeName": "WorkEvents",
      "kind": "table",
      "fields": [
        { "path": "ScopeId", "physicalType": "string", "typeVariants": [], "nullable": false },
        { "path": "RecordId", "physicalType": "string", "typeVariants": [], "nullable": false },
        { "path": "EventTime", "physicalType": "datetime", "typeVariants": [], "nullable": false },
        { "path": "State", "physicalType": "string", "typeVariants": [], "nullable": true },
        { "path": "ActorId", "physicalType": "string", "typeVariants": [], "nullable": true },
        { "path": "Details", "physicalType": "object", "typeVariants": ["object"], "nullable": true }
      ],
      "constraints": ["event-order-by-time"]
    }
  ],
  "hashAlgorithm": "sha256-jcs-structure-v1",
  "structureHash": "68fc3e599c5dcb5523a2d65c2d9586bfbec34d8b0dae0660659cf8b965533b13",
  "sourceVersion": "sha256:68fc3e599c5dcb5523a2d65c2d9586bfbec34d8b0dae0660659cf8b965533b13"
}
